STK_CDAT,STK_CODE,STK_NAME,STK_FIRST
2020-01-07,SPTO,Surya Pertiwi Tbk.,825.0
2020-01-07,SQMI,Wilton Makmur Indonesia Tbk.,324.0
2020-01-07,SRAJ,Sejahteraraya Anugrahjaya Tbk.,244.0
2020-01-07,SRIL,Sri Rejeki Isman Tbk.,262.0
2020-01-07,SRSN,Indo Acidatama Tbk,68.0
2020-01-07,SRTG,Saratoga Investama Sedaya Tbk.,3660.0
2020-01-07,SSIA,Surya Semesta Internusa Tbk.,635.0
2020-01-07,SSMS,Sawit Sumbermas Sarana Tbk.,825.0
2020-01-07,STAR,Buana Artha Anugerah Tbk.,160.0
2020-01-07,SULI,SLJ Global Tbk.,50.0
2020-01-07,SURE,Super Energy Tbk.,2930.0
2020-01-07,SWAT,Sriwahana Adityakarta Tbk.,103.0
2020-01-07,TALF,Tunas Alfin Tbk.,260.0
2020-01-07,TAMU,Pelayaran Tamarin Samudra Tbk.,358.0
2020-01-07,TAXI,Express Transindo Utama Tbk.,50.0
2020-01-07,TBIG,Tower Bersama Infrastructure Tbk.,1240.0
2020-01-07,TBLA,Tunas Baru Lampung Tbk.,970.0
2020-01-07,TBMS,Tembaga Mulia Semanan Tbk.,790.0
2020-01-07,TCPI,Transcoal Pacific Tbk.,6850.0
2020-01-07,TDPM,Tridomain Performance Materials Tbk.,244.0
2020-01-07,TEBE,Dana Brata Luhur Tbk.,1815.0
2020-01-07,TELE,Tiphone Mobile Indonesia Tbk.,302.0
2020-01-07,TFAS,Telefast Indonesia Tbk.,164.0
2020-01-07,TFCO,Tifico Fiber Indonesia Tbk.,302.0
2020-01-07,TGRA,Terregra Asia Energy Tbk.,118.0
2020-01-07,TIFA,Tifa Finance Tbk.,220.0
2020-01-07,TINS,Timah Tbk.,835.0
2020-01-07,TIRA,Tira Austenite Tbk,232.0
2020-01-07,TIRT,Tirta Mahakam Resources Tbk,53.0
2020-01-07,TKIM,Pabrik Kertas Tjiwi Kimia Tbk.,11200.0
2020-01-07,TLKM,Telekomunikasi Indonesia (Persero) Tbk.,3930.0
2020-01-07,TMAS,Temas Tbk.,103.0
2020-01-07,TNCA,Trimuda Nuansa Citra Tbk.,274.0
2020-01-07,TOBA,Toba Bara Sejahtra Tbk.,344.0
2020-01-07,TOPS,Totalindo Eka Persada Tbk.,216.0
2020-01-07,TOTL,Total Bangun Persada Tbk.,422.0
2020-01-07,TOTO,Surya Toto Indonesia Tbk.,294.0
2020-01-07,TOWR,Sarana Menara Nusantara Tbk.,800.0
2020-01-07,TPIA,Chandra Asri Petrochemical Tbk.,9850.0
2020-01-07,TPMA,Trans Power Marine Tbk.,224.0
2020-01-07,TRAM,Trada Alam Minera Tbk.,50.0
2020-01-07,TRAM-W,Waran Seri II Trada Alam Minera Tbk.,14.0
2020-01-07,TRIM,Trimegah Sekuritas Indonesia Tbk.,149.0
2020-01-07,TRIS,Trisula International Tbk.,264.0
2020-01-07,TRUK,Guna Timur Raya Tbk.,96.0
2020-01-07,TRUS,Trust Finance Indonesia Tbk,350.0
2020-01-07,TSPC,Tempo Scan Pacific Tbk.,1370.0
2020-01-07,TUGU,Asuransi Tugu Pratama Indonesia Tbk.,3420.0
2020-01-07,TURI,Tunas Ridean Tbk.,895.0
2020-01-07,UCID,Uni-Charm Indonesia Tbk.,1820.0
2020-01-07,ULTJ,Ultra Jaya Milk Industry & Trading Compa,1580.0
2020-01-07,UNIC,Unggul Indah Cahaya Tbk.,3750.0
2020-01-07,UNIT,Nusantara Inti Corpora Tbk,178.0
2020-01-07,UNSP,Bakrie Sumatera Plantations Tbk.,106.0
2020-01-07,UNTR,United Tractors Tbk.,21600.0
2020-01-07,UNVR,Unilever Indonesia Tbk.,8475.0
2020-01-07,URBN,Urban Jakarta Propertindo Tbk.,2240.0
2020-01-07,URBN-W,Waran Seri I Urban Jakarta Propertindo T,46.0
2020-01-07,VINS,Victoria Insurance Tbk.,125.0
2020-01-07,VINS-W,Waran Seri I Victoria Insurance Tbk.,13.0
2020-01-07,VIVA,Visi Media Asia Tbk.,63.0
2020-01-07,VOKS,Voksel Electric Tbk.,324.0
2020-01-07,WAPO,Wahana Pronatural Tbk.,77.0
2020-01-07,WEGE,Wijaya Karya Bangunan Gedung Tbk.,326.0
2020-01-07,WEHA,WEHA Transportasi Indonesia Tbk.,149.0
2020-01-07,WICO,Wicaksana Overseas International Tbk.,520.0
2020-01-07,WIIM,Wismilak Inti Makmur Tbk.,168.0
2020-01-07,WIKA,Wijaya Karya (Persero) Tbk.,2140.0
2020-01-07,WINS,Wintermar Offshore Marine Tbk.,123.0
2020-01-07,WOMF,Wahana Ottomitra Multiartha Tbk.,276.0
2020-01-07,WOOD,Integra Indocabinet Tbk.,650.0
2020-01-07,WOWS,Ginting Jaya Energi Tbk.,214.0
2020-01-07,WSBP,Waskita Beton Precast Tbk.,312.0
2020-01-07,WSKT,Waskita Karya (Persero) Tbk.,1525.0
2020-01-07,WTON,Wijaya Karya Beton Tbk.,464.0
2020-01-07,XAFA,Reksa Dana Avrist ETF Fixed Rate Bond I,1008.0
2020-01-07,XCID,DIRE Ciptadana Properti Ritel Indonesia,86.0
2020-01-07,XCIS,DIRE Ciptadana Properti Perhotelan Padja,105.0
2020-01-07,XIHD,Reksa Dana Indeks Premier ETF IDX High D,505.0
2020-01-07,XIIF,Reksa Dana Premier ETF Indonesia Financi,640.0
2020-01-07,XIIT,Reksa Dana Premier ETF IDX30,572.0
2020-01-07,XIJI,Reksa Dana Syariah Premier ETF JII,695.0
2020-01-07,XISR,Premier ETF SRI-KEHATI,409.0
2020-01-07,XMIG,Reksa Dana Indeks Majoris Pefindo I-Grad,179.0
2020-01-07,XPFT,Reksa Dana Indeks Pinnacle FTSE Indonesi,561.0
2020-01-07,XPMI,ETF Phillip MSCI Indonesia Equity Index,987.0
2020-01-07,YELO,Yelooo Integra Datanet Tbk.,63.0
2020-01-07,YELO-W,Waran Seri I Yelooo Integra Datanet Tbk.,18.0
2020-01-07,YULE,Yulie Sekuritas Indonesia Tbk.,220.0
2020-01-07,ZBRA,Zebra Nusantara Tbk,101.0
2020-01-07,ZINC,Kapuas Prima Coal Tbk.,388.0
2020-01-07,ZONE,Mega Perintis Tbk.,494.0
